アース神族が住んでいる世界の中心は？,2,ヨトゥンヘイム,アースガルズ,ムスペルヘイム,ヘルヘイム,『マイティ・ソー』,映画『マイティ・ソー』の世界ではオーディンやソーが住む神々の住む国「アスガルド」として扱われ、9つの国の世界の平穏を守る役割を担っている。
オーディンの妻で愛と結婚と豊穣の女神は？,2,ヘラ,フリッグ,ノルン,フレイヤ,『マイティ・ソー』,映画『マイティ・ソー』でも、オーディンの妻、ソーの母として「フリッガ」として登場する。
オーディンが持つ槍と言えば？,2,ミョルニル,グングニル,トライデント,エクスカリバー,『FF』,ゲーム『FF』に登場するオーディンが使用する技として登場。
フレイ、フレイヤは何神族か？,2,アース神族,ヴァン神族,リーフ神族,ガルド神族,『ヴァン神族』,北欧神話では『ヴァン神族』と『アース神族』との神族同士で戦争が起きた。
神々に敵対し、炎で世界を焼き尽くした巨人は？,1,スルト,ドラグニル,ティポン,アグニ,『マイティ・ソー』,映画『マイティ・ソー』では、炎の悪魔の国「ムスペルヘイト」の王「スルト」として登場し、アスガルドの滅亡を招く。
いたずら好きのロキが起こした事件とは？,3,星泥棒事件,落とし穴事件,丸刈り事件,宇宙爆発事件,『丸刈り事件』,雷神トールの妻である女神「シヴ」の美しい金髪を丸刈りにしてしまった事件。
北欧神話の神は不死ではない為、老いることがないよう、何を食べているか？,4,ザクロ,ブドウ,イチゴ,リンゴ,『黄金の林檎』,『黄金の林檎』は、様々な国や民族に伝承される民話の果実である。北欧神話では、神の食べ物、または不死の源として描かれている。
ユグドラシルの根元にある泉の数は？,4,4つ,1つ,2つ,3つ,『進撃の巨人』,この3という数字もまたアニメ『進撃の巨人』の内容にも影響している。※ネタバレになるのでここまで。
オーディンに付き添う一対のワタリガラスの名前はフギンと？,3,ゲリ,フレキ,ムニン,スレイプニル,『終末のワルキューレ』,「フギン」は思考、「ムニン」は記憶を意味し、オーディンに様々な情報を伝える為、世界中を飛び回っている。アニメ『終末のワルキューレ』でも、オーディンの肩に乗っている。
